{
  "id": "antverpia-lied",
  "title": "ANTVERPIA LIED",
  "sortTitle": "ANTVERPIA LIED",
  "section": "kringliederen",
  "language": "nl",
  "clubId": "antverpia",
  "pages": {
    "start": 33,
    "end": 33
  },
  "lyricist": null,
  "melody": "‘In ’t Antwerps a.u.b.’, De Strangers",
  "notes": null,
  "stanzas": [
    {
      "kind": "verse",
      "lines": [
        "Antwârpe ... gij zè ga veur mij",
        "Toch de stad waar azzek zèn gebore",
        "De Greunpleuts, de Meir ... de Keyserlei",
        "Daar hemme kik m’n hart verlore"
      ]
    },
    {
      "kind": "verse",
      "lines": [
        "Antwârpe ... waar da’k ik ook ben",
        "Ik kan nievrans mijnen draai ni vinde",
        "’k Weet het ’t is flaa ... mor ik beken",
        "Bij aa zèn ’k thuis ... en onder vrinde"
      ]
    },
    {
      "kind": "verse",
      "lines": [
        "Cheerio, Cheerio,",
        "In Antwerpen daar poepen ze zo",
        "Eerst met de vinger en dan met de fluit",
        "Ge steekt hem erin en ge trekt hem eruit",
        "En zolang er Sinjoren bestaan,",
        "Zal Antwerpen nooit niet vergaan.",
        "Wij weten wat lol is, als ’t pintje maar vol is",
        "De rest trekken wij ons niet aan!"
      ]
    }
  ],
  "footnotes": []
}
